{
  "schemaVersion": "1.0.0",
  "generatedAt": "2026-05-02T12:02:58+00:00",
  "refreshMode": "update",
  "yearFrom": 1985,
  "yearTo": 2026,
  "currentYear": 2026,
  "inputHashes": {
    "vehiclesComsccCatalog": "sha256:f773d44a18692f62fb4d373fef1786dfbd798b9cca4d09a1033b3f5421018875"
  },
  "vpic": {
    "totalRequests": 1659,
    "failures": 15,
    "failRate": 0.009041591320072333,
    "responseSetHash": "sha256:5aa0b4cf5446b9e4fbe08d8da34dd385eace6431394efbe7ea063a6702aaa3fb"
  }
}
